{
  "version": "0.1",
  "attestation_id": "att-2026-04-13T14:30:00Z-host-1",
  "subject_id": "spiffe://example/host/nixos-1",
  "subject_kind": "host",
  "verifier_id": "attest-main",
  "posture_digest": "sha256:good-posture-digest",
  "status": "verified",
  "measured_at": "2026-04-13T14:30:00Z",
  "expires_at": "2026-04-13T14:35:00Z",
  "claims": {
    "boot": "measured",
    "policy": "current",
    "workload_identity": true
  },
  "evidence_refs": [
    "evidence://attestation/att-2026-04-13T14:30:00Z-host-1"
  ]
}
